<?xml version="1.0" encoding="UTF-8"?>
<wrapper xmlns:xsi="http://www.w3.org/2001/XMLSchema-instance" xsi:noNamespaceSchemaLocation="app-starter.xsd">
  <response status="0">
    <message>
      <exceptionClass>exceptionClass</exceptionClass>
      <messageBody>messageBody</messageBody>
    </message>
    <login>
      <username>username</username>
      <nonce>nonce</nonce>
      <identifier>identifier</identifier>
      <sessionID>sessionID</sessionID>
    </login>
  </response>
  <request>
    <login>
      <username>username</username>
      <nonce>nonce</nonce>
      <identifier>identifier</identifier>
      <sessionID>sessionID</sessionID>
    </login>
  </request>
</wrapper>
